{
  "$schema": "http://json-schema.org/draft-07/schema#",
  "$id": "https://pmcram.app/schema/guide.schema.json",
  "title": "PM Cram study guide",
  "description": "A read-and-absorb study guide (mindset, agile, exam strategy). Text only — no images. Identified by title (case-insensitive). Sections render without a markdown parser: a blank line separates paragraphs, and lines starting with '- ' become bullets.",
  "type": "object",
  "required": ["title", "category", "sections"],
  "additionalProperties": false,
  "properties": {
    "schema": { "type": "string", "const": "guide/v1" },
    "title": { "type": "string", "description": "Guide name. Natural key used to dedupe across files (case-insensitive)." },
    "category": { "type": "string", "description": "Grouping shown in the app, e.g. Mindset, Agile, Exam strategy." },
    "summary": { "type": "string", "description": "One-line description shown in the guide list and at the top of the reader." },
    "sections": {
      "type": "array",
      "minItems": 1,
      "items": {
        "type": "object",
        "required": ["heading", "body"],
        "additionalProperties": false,
        "properties": {
          "heading": { "type": "string" },
          "body": { "type": "string", "description": "Plain text. Blank line = new paragraph; lines starting with '- ' render as a bullet list." },
          "tip": { "type": "string", "description": "Optional exam-tip callout, shown highlighted under the section." },
          "figure": {
            "type": "object",
            "additionalProperties": false,
            "description": "Optional diagram. Provide EITHER an inline SVG string (vector, theme-aware, preferred) OR a raster image path (repo-relative, e.g. content/assets/charts/x.png, shown on a light figure card).",
            "properties": {
              "svg": { "type": "string", "description": "Inline <svg> markup. Use single quotes for attributes and 'currentColor' for axes/labels so it themes." },
              "image": { "type": "string", "description": "Repo-relative path or absolute URL of a raster image." },
              "caption": { "type": "string" }
            }
          },
          "signals": {
            "type": "array",
            "description": "OPTIONAL. Keypoints for this section — shown as an 'Exam signal' card.",
            "items": {
              "type": "object",
              "required": ["title"],
              "additionalProperties": false,
              "properties": {
                "title": { "type": "string" },
                "note": { "type": "string" }
              }
            }
          },
          "trace": {
            "type": "array",
            "items": { "type": "string" },
            "description": "OPTIONAL. Ordered reasoning steps rendered as a numbered 'Decision trace'."
          },
          "rules": {
            "type": "array",
            "description": "OPTIONAL. Reusable takeaways (term — meaning) shown as rule cards.",
            "items": {
              "type": "object",
              "required": ["term", "meaning"],
              "additionalProperties": false,
              "properties": {
                "term": { "type": "string" },
                "meaning": { "type": "string" }
              }
            }
          },
          "kicker": { "type": "string", "description": "OPTIONAL. Mono kicker shown above the heading." },
          "blocks": {
            "type": "array",
            "description": "OPTIONAL. Ordered structured blocks: tip / steps / cards / table / terms / formulas.",
            "items": {
              "type": "object",
              "required": ["kind"],
              "additionalProperties": false,
              "properties": {
                "kind": { "enum": ["tip", "steps", "cards", "table", "terms", "formulas"] },
                "title": { "type": "string" },
                "note": { "type": "string" },
                "text": { "type": "string" },
                "tone": { "enum": ["neutral", "accent", "good", "warn", "bad"] },
                "lines": { "type": "array", "items": { "type": "string" } },
                "items": { "type": "array", "items": { "type": "object" } },
                "rows": {
                  "type": "array",
                  "items": {
                    "type": "object",
                    "required": ["key", "value"],
                    "additionalProperties": false,
                    "properties": { "key": { "type": "string" }, "value": { "type": "string" } }
                  }
                }
              }
            }
          }
        }
      }
    },
    "tags": { "type": "array", "items": { "type": "string" } },
    "source": { "type": "string" }
  }
}
