[
  {
    "schema": "guide/v1",
    "title": "Knowledge Management in Projects",
    "category": "Process",
    "summary": "Capture, share and reuse tacit and explicit project knowledge so lessons are available at the moment of need. In PMBOK 8 this work supports the Project Work performance domain and the Team principle, and the lessons it surfaces feed the focus on value.",
    "sections": [
      {
        "kicker": "PMBOK 8 lens",
        "heading": "Where knowledge management fits",
        "body": "PMBOK 8 is principle-based, not process-group based. Managing knowledge lives inside the Project Work performance domain - efficient processes and clear communication - and is powered by the Team principle: a collaborative team shares what it knows. Lessons learned are not paperwork; they inform the Value principle by helping future work make better decisions.",
        "blocks": [
          {
            "kind": "tip",
            "title": "How to use this",
            "tone": "accent",
            "lines": [
              "Project Work domain = the what: keep knowledge flowing so the work runs efficiently.",
              "Team principle = the who: collaboration and interaction move know-how person to person.",
              "Value principle = the why: reused lessons raise the value of future decisions.",
              "The aim is knowledge at the MOMENT of need, not filed and forgotten."
            ]
          }
        ]
      },
      {
        "kicker": "Two kinds",
        "heading": "Tacit vs explicit knowledge",
        "body": "Managing project knowledge means sharing BOTH kinds. Explicit knowledge moves through repositories and documents; tacit knowledge needs interaction - conversation, pairing, mentoring and observation - because it cannot be fully captured on a page.",
        "blocks": [
          {
            "kind": "cards",
            "items": [
              {
                "title": "Explicit knowledge",
                "badge": "Codified",
                "tone": "accent",
                "groups": [
                  { "label": "What it is", "lines": ["Easily written down and stored.", "Documents, data, procedures, templates."] },
                  { "label": "How it moves", "lines": ["Through repositories and documents.", "Copy it, store it, retrieve it."] }
                ]
              },
              {
                "title": "Tacit knowledge",
                "badge": "Personal",
                "tone": "good",
                "groups": [
                  { "label": "What it is", "lines": ["Personal know-how, experience, judgement, intuition.", "Hard to articulate; it lives in people's heads."] },
                  { "label": "How it moves", "lines": ["Through interaction, not documents.", "Conversation, pairing, mentoring, observation."] }
                ]
              }
            ]
          },
          {
            "kind": "tip",
            "title": "Exam cue",
            "tone": "neutral",
            "text": "If an answer can be copied into a document it is explicit; if it has to be demonstrated or discussed it is tacit."
          }
        ]
      },
      {
        "kicker": "Value ladder",
        "heading": "The DIKW hierarchy",
        "body": "Knowledge is built up in stages. Value rises at each level as raw numbers become understanding and, finally, good judgement.",
        "blocks": [
          {
            "kind": "steps",
            "title": "Data -> Information -> Knowledge -> Wisdom",
            "items": [
              { "title": "Data", "lines": ["Raw measurements and facts with no context."] },
              { "title": "Information", "lines": ["Data placed in context so it has meaning."] },
              { "title": "Knowledge", "lines": ["Information combined with experience to understand and act."] },
              { "title": "Wisdom", "lines": ["Applying knowledge with sound judgement to make good decisions."] }
            ]
          },
          {
            "kind": "tip",
            "title": "Exam cue",
            "tone": "neutral",
            "text": "Wisdom is knowing which knowledge to apply - and when not to."
          }
        ]
      },
      {
        "kicker": "Moment of need",
        "heading": "Managing project knowledge",
        "body": "This work draws on existing organisational knowledge - lessons learned from prior projects - AND creates new knowledge during the current project. Knowledge that is captured but never consulted adds no value.",
        "blocks": [
          {
            "kind": "table",
            "title": "Registers and repositories",
            "rows": [
              { "key": "Lessons register", "value": "Captures lessons during the project, as they happen." },
              { "key": "Lessons repository", "value": "Rolls up at close into an organisation-wide store for future projects." },
              { "key": "Draws on", "value": "Prior organisational knowledge plus new knowledge made on this project." },
              { "key": "Goal", "value": "Make knowledge usable at the moment of need, not filed and forgotten." }
            ]
          },
          {
            "kind": "tip",
            "title": "Exam cue",
            "tone": "good",
            "text": "Knowledge is an asset only when it reaches the right person at the right time."
          }
        ]
      },
      {
        "kicker": "Cadence and audience",
        "heading": "Lessons learned vs retrospectives",
        "body": "Same goal - learning - but the contrast is cadence and audience. Lessons learned are periodic and outward-facing to the organisation; retrospectives are frequent and inward-facing to the team.",
        "blocks": [
          {
            "kind": "cards",
            "items": [
              {
                "title": "Lessons learned",
                "badge": "Organisation",
                "tone": "accent",
                "groups": [
                  { "label": "When", "lines": ["Captured throughout, and formally at close."] },
                  { "label": "Who benefits", "lines": ["The organisation, on future work."] }
                ]
              },
              {
                "title": "Retrospectives",
                "badge": "Team",
                "tone": "good",
                "groups": [
                  { "label": "When", "lines": ["End of every iteration."] },
                  { "label": "Who benefits", "lines": ["This team and its way of working right now."] }
                ]
              }
            ]
          },
          {
            "kind": "tip",
            "title": "Exam cue",
            "tone": "neutral",
            "text": "Retrospectives improve this team this sprint; lessons learned improve future projects."
          }
        ]
      },
      {
        "kicker": "Move the know-how",
        "heading": "Transferring knowledge",
        "body": "Use methods that move tacit knowledge, not just documents. The usual barrier is behaviour - people simply do not consult what exists - so build knowledge checks into planning and review checkpoints.",
        "blocks": [
          {
            "kind": "table",
            "title": "Transfer methods",
            "rows": [
              { "key": "Communities of practice", "value": "Groups that share a discipline exchange know-how." },
              { "key": "Pairing / shadowing", "value": "Know-how passes person to person on the job." },
              { "key": "Storytelling", "value": "Conveys context and reasoning behind decisions." },
              { "key": "Mentoring", "value": "Grows judgement over time." },
              { "key": "Knowledge repository", "value": "Usable, findable store for explicit content." }
            ]
          },
          {
            "kind": "tip",
            "title": "Exam cue",
            "tone": "good",
            "text": "Pull beats push: design the work so people reach for prior knowledge naturally."
          }
        ]
      },
      {
        "kicker": "Keep it, don't lose it",
        "heading": "Why knowledge is lost and how to keep it",
        "body": "Knowledge is lost when it is captured too late, stored where no one can find it, or never rewarded, and when staff leave taking tacit know-how with them.",
        "blocks": [
          {
            "kind": "steps",
            "title": "How to keep it",
            "items": [
              { "title": "Capture at the right moment", "lines": ["Record while the detail is still fresh."] },
              { "title": "Make it findable", "lines": ["Well organised and easy to retrieve."] },
              { "title": "Recognise sharing", "lines": ["Reward the people who pass knowledge on."] },
              { "title": "Build a blameless culture", "lines": ["Psychological safety so honest lessons surface."] }
            ]
          },
          {
            "kind": "tip",
            "title": "Exam cue",
            "tone": "warn",
            "text": "No blame, no fear, no hidden lessons - if surfacing a problem invites punishment, the same mistakes repeat."
          }
        ]
      }
    ],
    "tags": ["knowledge management", "lessons learned", "retrospectives", "tacit knowledge", "DIKW", "process", "pmbok 8", "project work", "team principle", "value"],
    "source": "PM Cram study notes - reworded and restructured for the PMBOK 8 principle-based PMP exam."
  }
]
