[
  {
    "schema": "guide/v1",
    "title": "Charts",
    "category": "Charts & Diagrams",
    "summary": "The visuals that show up on the PMP exam — what each one is for and how to read it.",
    "sections": [
      {
        "heading": "Pareto chart",
        "body": "A bar chart of causes ordered from most to least frequent, with a line showing the running cumulative percentage. It's a quality tool used to find which few causes drive most of the problems, so you fix those first.\n\n- Bars: frequency of each cause, tallest on the left\n- Line: cumulative percentage across the causes",
        "tip": "Pareto = the 80/20 rule: focus on the 'vital few' causes on the left, not the 'trivial many' on the right.",
        "figure": {
          "svg": "<svg viewBox='0 0 320 190' xmlns='http://www.w3.org/2000/svg' fill='none'><line x1='40' y1='18' x2='40' y2='160' stroke='currentColor' stroke-width='1.5'/><line x1='40' y1='160' x2='300' y2='160' stroke='currentColor' stroke-width='1.5'/><rect x='52' y='52' width='34' height='108' fill='#1F5FA8'/><rect x='100' y='82' width='34' height='78' fill='#1F5FA8'/><rect x='148' y='112' width='34' height='48' fill='#1F5FA8'/><rect x='196' y='134' width='34' height='26' fill='#1F5FA8'/><rect x='244' y='148' width='34' height='12' fill='#1F5FA8'/><polyline points='69,50 117,32 165,23 213,19 261,17' stroke='#B5462F' stroke-width='2'/><circle cx='69' cy='50' r='3' fill='#B5462F'/><circle cx='117' cy='32' r='3' fill='#B5462F'/><circle cx='165' cy='23' r='3' fill='#B5462F'/><circle cx='213' cy='19' r='3' fill='#B5462F'/><circle cx='261' cy='17' r='3' fill='#B5462F'/><text x='170' y='182' fill='currentColor' font-size='11' text-anchor='middle'>causes — most frequent first</text></svg>",
          "caption": "Bars: frequency (descending). Line: cumulative %."
        }
      },
      {
        "heading": "Control chart",
        "body": "A run of measurements over time with a centre line (the process mean) and an upper and lower control limit. It tells you whether a process is stable and 'in control'.\n\n- Points inside the limits and randomly scattered = stable\n- A point outside a limit, or a non-random run, signals a special cause to investigate",
        "tip": "Out of control = a point beyond UCL/LCL, or the 'rule of seven' (seven points in a row on one side of the mean).",
        "figure": {
          "svg": "<svg viewBox='0 0 320 190' xmlns='http://www.w3.org/2000/svg' fill='none'><line x1='40' y1='30' x2='300' y2='30' stroke='#B5462F' stroke-width='1.4' stroke-dasharray='4 4'/><line x1='40' y1='150' x2='300' y2='150' stroke='#B5462F' stroke-width='1.4' stroke-dasharray='4 4'/><line x1='40' y1='90' x2='300' y2='90' stroke='currentColor' stroke-width='1.4'/><polyline points='55,96 82,78 109,102 136,74 163,96 190,70 217,100 244,22 271,86' stroke='#1F5FA8' stroke-width='2'/><circle cx='55' cy='96' r='3' fill='#1F5FA8'/><circle cx='82' cy='78' r='3' fill='#1F5FA8'/><circle cx='109' cy='102' r='3' fill='#1F5FA8'/><circle cx='136' cy='74' r='3' fill='#1F5FA8'/><circle cx='163' cy='96' r='3' fill='#1F5FA8'/><circle cx='190' cy='70' r='3' fill='#1F5FA8'/><circle cx='217' cy='100' r='3' fill='#1F5FA8'/><circle cx='244' cy='22' r='4' fill='#B5462F'/><circle cx='271' cy='86' r='3' fill='#1F5FA8'/><text x='304' y='30' fill='#B5462F' font-size='10' text-anchor='end'>UCL</text><text x='304' y='150' fill='#B5462F' font-size='10' text-anchor='end'>LCL</text><text x='304' y='86' fill='currentColor' font-size='10' text-anchor='end'>mean</text></svg>",
          "caption": "The red point above the UCL is out of control."
        }
      },
      {
        "heading": "Burndown chart",
        "body": "An agile chart showing work remaining over a sprint or release. The straight 'ideal' line runs from all the work down to zero; the 'actual' line is the real remaining work each day.\n\n- Actual above the ideal line = behind\n- Actual below = ahead",
        "tip": "Burndown shows work remaining (going down). A burn-up chart instead shows work completed against total scope (going up).",
        "figure": {
          "svg": "<svg viewBox='0 0 320 190' xmlns='http://www.w3.org/2000/svg' fill='none'><line x1='40' y1='20' x2='40' y2='160' stroke='currentColor' stroke-width='1.5'/><line x1='40' y1='160' x2='300' y2='160' stroke='currentColor' stroke-width='1.5'/><line x1='44' y1='34' x2='296' y2='158' stroke='currentColor' stroke-width='1.4' stroke-dasharray='5 4'/><polyline points='44,34 90,52 136,86 182,96 228,128 296,158' stroke='#1F5FA8' stroke-width='2'/><text x='250' y='52' fill='currentColor' font-size='10'>ideal</text><text x='150' y='80' fill='#1F5FA8' font-size='10'>actual</text><text x='170' y='182' fill='currentColor' font-size='11' text-anchor='middle'>sprint days</text></svg>",
          "caption": "Work remaining vs the ideal line, across the sprint."
        }
      },
      {
        "heading": "Burn-up chart",
        "body": "The companion to the burndown. Instead of work remaining, it plots work completed (rising) against a separate line for total scope. Because scope is its own line, you can see scope changes that a burndown would hide.\n\n- Completed line climbs toward the scope line\n- The scope line steps up when work is added",
        "tip": "Burn-up separates progress from scope — a jump in the top line means scope was added, not that the team slowed down.",
        "figure": {
          "svg": "<svg viewBox='0 0 320 190' xmlns='http://www.w3.org/2000/svg' fill='none'><line x1='40' y1='20' x2='40' y2='160' stroke='currentColor' stroke-width='1.5'/><line x1='40' y1='160' x2='300' y2='160' stroke='currentColor' stroke-width='1.5'/><polyline points='44,60 170,60 170,42 296,42' stroke='#B5462F' stroke-width='1.6' stroke-dasharray='5 4'/><polyline points='44,158 92,140 140,110 188,96 236,70 296,46' stroke='#2F6F5E' stroke-width='2'/><text x='250' y='36' fill='#B5462F' font-size='10'>scope</text><text x='150' y='118' fill='#2F6F5E' font-size='10'>completed</text><text x='170' y='182' fill='currentColor' font-size='11' text-anchor='middle'>sprint days</text></svg>",
          "caption": "Completed work rising toward total scope (which steps up when scope is added)."
        }
      },
      {
        "heading": "Cause-and-effect (fishbone / Ishikawa)",
        "body": "A root-cause tool. The 'effect' (the problem) sits at the head; angled 'bones' group the possible causes into categories, with finer sub-causes branching off each. It structures a team's brainstorming so you investigate causes by category rather than at random.",
        "tip": "Fishbone = Ishikawa = cause-and-effect diagram (three names, one tool). It explores possible causes; it doesn't prove them.",
        "figure": {
          "svg": "<svg viewBox='0 0 340 200' xmlns='http://www.w3.org/2000/svg' fill='none'><line x1='16' y1='100' x2='266' y2='100' stroke='currentColor' stroke-width='1.6'/><polygon points='266,94 278,100 266,106' fill='currentColor'/><rect x='280' y='84' width='52' height='32' rx='4' stroke='currentColor' stroke-width='1.4'/><text x='306' y='104' fill='currentColor' font-size='10' text-anchor='middle'>Effect</text><line x1='70' y1='44' x2='104' y2='100' stroke='#1F5FA8' stroke-width='1.5'/><line x1='170' y1='44' x2='204' y2='100' stroke='#1F5FA8' stroke-width='1.5'/><line x1='70' y1='156' x2='104' y2='100' stroke='#1F5FA8' stroke-width='1.5'/><line x1='170' y1='156' x2='204' y2='100' stroke='#1F5FA8' stroke-width='1.5'/><text x='66' y='38' fill='currentColor' font-size='10' text-anchor='middle'>People</text><text x='166' y='38' fill='currentColor' font-size='10' text-anchor='middle'>Process</text><text x='66' y='170' fill='currentColor' font-size='10' text-anchor='middle'>Tools</text><text x='166' y='170' fill='currentColor' font-size='10' text-anchor='middle'>Environment</text></svg>",
          "caption": "Causes grouped on bones; the problem (effect) at the head."
        }
      }
    ],
    "tags": ["charts", "quality", "agile", "exam"],
    "source": "PM Cram study notes — reworded for the current ECO-based PMP exam."
  }
]
