[
  {
    "schema": "guide/v1",
    "title": "Boards & Matrices",
    "category": "Diagrams",
    "summary": "Two everyday project visuals — the Kanban board for flow, and the RACI matrix for who does what.",
    "sections": [
      {
        "heading": "Kanban board",
        "body": "A visual board that pulls work through columns — typically To Do, In Progress, and Done. A work-in-progress (WIP) limit caps how many items a column may hold, which exposes bottlenecks and keeps the team focused on finishing before starting.",
        "tip": "Kanban = visualise flow, limit WIP, pull work. A WIP limit is the key lever — lower it to surface bottlenecks.",
        "figure": {
          "svg": "<svg viewBox='0 0 330 200' xmlns='http://www.w3.org/2000/svg' fill='none'><text x='58' y='20' fill='currentColor' font-size='11' text-anchor='middle'>To Do</text><text x='165' y='20' fill='currentColor' font-size='11' text-anchor='middle'>In Progress</text><text x='165' y='33' fill='#B5462F' font-size='9' text-anchor='middle'>WIP limit 2</text><text x='272' y='20' fill='currentColor' font-size='11' text-anchor='middle'>Done</text><rect x='10' y='40' width='96' height='150' rx='5' stroke='currentColor' stroke-width='1.2'/><rect x='117' y='40' width='96' height='150' rx='5' stroke='#B5462F' stroke-width='1.3'/><rect x='224' y='40' width='96' height='150' rx='5' stroke='currentColor' stroke-width='1.2'/><rect x='18' y='50' width='80' height='24' rx='3' stroke='currentColor' stroke-width='1'/><rect x='18' y='80' width='80' height='24' rx='3' stroke='currentColor' stroke-width='1'/><rect x='18' y='110' width='80' height='24' rx='3' stroke='currentColor' stroke-width='1'/><rect x='125' y='50' width='80' height='24' rx='3' stroke='#1F5FA8' stroke-width='1.3'/><rect x='125' y='80' width='80' height='24' rx='3' stroke='#1F5FA8' stroke-width='1.3'/><rect x='232' y='50' width='80' height='24' rx='3' fill='#E7F1ED' stroke='#2F6F5E' stroke-width='1'/><rect x='232' y='80' width='80' height='24' rx='3' fill='#E7F1ED' stroke='#2F6F5E' stroke-width='1'/></svg>",
          "caption": "Cards pulled left to right; the middle column is capped at its WIP limit."
        }
      },
      {
        "heading": "RACI (responsibility assignment matrix)",
        "body": "A grid that maps activities (rows) to roles (columns), recording each role's involvement:\n\n- R — Responsible: does the work\n- A — Accountable: owns the outcome (exactly one per row)\n- C — Consulted: gives input (two-way)\n- I — Informed: kept in the loop (one-way)",
        "tip": "Exactly one 'A' per row — one person is accountable. Several can be R/C/I, but accountability can't be shared.",
        "figure": {
          "svg": "<svg viewBox='0 0 330 175' xmlns='http://www.w3.org/2000/svg' fill='none'><line x1='10' y1='10' x2='320' y2='10' stroke='currentColor' stroke-width='1'/><line x1='10' y1='40' x2='320' y2='40' stroke='currentColor' stroke-width='1'/><line x1='10' y1='74' x2='320' y2='74' stroke='currentColor' stroke-width='0.8'/><line x1='10' y1='108' x2='320' y2='108' stroke='currentColor' stroke-width='0.8'/><line x1='10' y1='142' x2='320' y2='142' stroke='currentColor' stroke-width='1'/><line x1='10' y1='10' x2='10' y2='142' stroke='currentColor' stroke-width='1'/><line x1='120' y1='10' x2='120' y2='142' stroke='currentColor' stroke-width='1'/><line x1='170' y1='10' x2='170' y2='142' stroke='currentColor' stroke-width='0.6'/><line x1='220' y1='10' x2='220' y2='142' stroke='currentColor' stroke-width='0.6'/><line x1='270' y1='10' x2='270' y2='142' stroke='currentColor' stroke-width='0.6'/><line x1='320' y1='10' x2='320' y2='142' stroke='currentColor' stroke-width='1'/><text x='145' y='30' fill='currentColor' font-size='10' text-anchor='middle'>PM</text><text x='195' y='30' fill='currentColor' font-size='9' text-anchor='middle'>Sponsor</text><text x='245' y='30' fill='currentColor' font-size='10' text-anchor='middle'>Team</text><text x='295' y='30' fill='currentColor' font-size='10' text-anchor='middle'>QA</text><text x='16' y='61' fill='currentColor' font-size='10'>Charter</text><text x='16' y='95' fill='currentColor' font-size='10'>Plan</text><text x='16' y='129' fill='currentColor' font-size='10'>Build</text><text x='145' y='61' fill='#1F5FA8' font-size='11' text-anchor='middle'>R</text><text x='195' y='61' fill='#B5462F' font-size='11' text-anchor='middle'>A</text><text x='245' y='61' fill='currentColor' font-size='11' text-anchor='middle'>C</text><text x='295' y='61' fill='currentColor' font-size='11' text-anchor='middle'>I</text><text x='145' y='95' fill='#B5462F' font-size='11' text-anchor='middle'>A</text><text x='195' y='95' fill='currentColor' font-size='11' text-anchor='middle'>C</text><text x='245' y='95' fill='#1F5FA8' font-size='11' text-anchor='middle'>R</text><text x='295' y='95' fill='currentColor' font-size='11' text-anchor='middle'>I</text><text x='145' y='129' fill='#B5462F' font-size='11' text-anchor='middle'>A</text><text x='195' y='129' fill='currentColor' font-size='11' text-anchor='middle'>I</text><text x='245' y='129' fill='#1F5FA8' font-size='11' text-anchor='middle'>R</text><text x='295' y='129' fill='currentColor' font-size='11' text-anchor='middle'>C</text><text x='165' y='162' fill='currentColor' font-size='9' text-anchor='middle'>R responsible · A accountable · C consulted · I informed</text></svg>",
          "caption": "Roles across the top, activities down the side; one A per row."
        }
      }
    ],
    "tags": ["diagrams", "agile", "people", "exam"],
    "source": "PM Cram study notes — reworded for the current ECO-based PMP exam."
  }
]
